Product,Price
Soft pontaj Gratuit CrossChex pentru ANVIZ,"0 , 00 Lei"
"Suport ecuson, deschidere si prindere verticala, 55x90x3.5mm, CH-151V","0 , 99 Lei"
"Cartela de proximitate RFID 125Khz Cprox, ID CARD","1 , 69 Lei"
"Tag de proximitate RFID de tip Breloc cod secvential, IDT-2000EM","1 , 89 Lei"
"Suport ecuson pentru carduri control acces Yli CH-001V, din PVC, prindere verticala, albastru","2 , 19 Lei"
"Cartela electromagnetica duala, RFID si UHF, IDT-1001EM/UHF","2 , 99 Lei"
"Eticheta autoadeziva cu CIP RFID EM4100 pe 125KHz, 0.6mm, alb, IDT-3000EM","3 , 39 Lei"
"Tag de proximitate Mifare, pentru videointerfon, IDT-2000MF","3 , 49 Lei"
Doza pentru montarea ingropata a economizoarelor pentru HLES-30A-TEMIC,"3 , 49 Lei"
"Cartela de proximitate RFID (125KHz) numerotata secvential, ID CARD1","3 , 75 Lei"
"Snur cu port pentru ecuson, retractabil, Negru, CH-425","3 , 79 Lei"
"Cartela de proximitate Mifare 13,56 Mhz, IDT-1001MF","3 , 99 Lei"
"Tag de proximitate cu cip MIFARE (13.56MHz), Hikvision, DS-K7M102-M","3 , 99 Lei"
"Tag de proximitate PROGRAMABIL, RFID 125 Khz, IDT-2000EM-RW","4 , 29 Lei"
"Cartela de proximitate Rosslare ATR14WO-001, pentru cititoare RFID 125KHz","4 , 99 Lei"
"Tag suplimentar pentru kiturile de control acces WS2 si WS2K, WS2(K)Tag","4 , 99 Lei"
"Doza din plastic pentru economizor, ABK-802+K(G), Yli","4 , 99 Lei"
"Tag NFC antimetal cu cip 13.56 MHz, NFC-2013-gy","5 , 19 Lei"
"Cartela de proximitate duala RFID 125Khz si MIFARE 13,56Mhz, IDT-1001EM/MF","5 , 99 Lei"
"Bratara de proximitate din silicon cu catarama 125Khz, verde IDT-4001EM-GN","5 , 99 Lei"
"Bratara de proximitate din silicon, RFID 125Khz, SECUKEY Sbracelet 1 (EM)","5 , 99 Lei"
"Bratara de proximitate din silicon, RFID 125Khz, SECUKEY Sbracelet 1 (EM), Albastra","6 , 19 Lei"
"Cartela interfon Electra, TAG.ELT.000","6 , 29 Lei"
"Bratara de proximitate din silicon, RFID 125Khz, SECUKEY Sbracelet 2 (EM)","6 , 49 Lei"
"Bratara de proximitate din silicon cu catarama 125Khz, Rosie, IDT-4009EM-RD","7 , 49 Lei"
"Bratara de proximitate din silicon cu catarama 125Khz, Albastra, IDT-4009EM-BL","7 , 49 Lei"
"Bratara de proximitate din silicon cu catarama 125Khz, galbena, IDT-4009EM-YO","7 , 49 Lei"
"Bratara de proximitate din silicon cu catarama metalica, 125Khz, Verde, IDT-4009EM-GN","7 , 49 Lei"
"Adaos special inchizator, Electra ADS.S1x.INC","8 , 19 Lei"
"Tag de proximitate pentru cititoare 125KHz, Rosslare ATR13W0-A01 TAG","8 , 29 Lei"
Cartela de proximitate MIFARE s50 pentru acces hotelier HLC-M-A,"8 , 69 Lei"
"Doza cu montare aplicata sau incastrata, pentru butoane si controlere de control acces, SECUKEY, EBOX1","9 , 99 Lei"
Tag UHF Anti Metal ACM-UHF-M,"9 , 99 Lei"
Adaos pentru yala aplicata Electra ADS.13x.YEM,"10 , 99 Lei"
Extensie cilindru 5MM pentru yale smart D1 si D1K,"10 , 99 Lei"
"Cartele de acces TEMIC pentru sistem hotelier, HLC-T-K-V20","11 , 49 Lei"
Breloc MIFARE pentru incuietoarea de apart-hotel DLK-929SS-6M,"12 , 99 Lei"
Buton de iesire din plastic PBK-812A,"12 , 99 Lei"
Set 3 adaosuri pentru inchizator yala Electra SET.235.INC,"13 , 99 Lei"
"Doza cu montare aplicata sau incastrata, pentru butoane si controlere de control acces, SECUKEY, Ebox2","15 , 00 Lei"
"Buton de iesire, aplicabil din otel inoxidabil, NO/COM, SECUKEY Cbutton 2","16 , 99 Lei"
"Buton iesire urgenta, rosu, aparent, ACM-K3R","16 , 99 Lei"
Extensie cilindru 10MM pentru yale smart D1 si D1K D1ACC10mm,"19 , 99 Lei"
"Suport scurt pentru yale Dorcas, DORCAS-B-X","20 , 99 Lei"
"Suport lung pentru yale Dorcas, DORCAS-EZH-25","20 , 99 Lei"
"Suport U pentru electromagnetul de 180Kgf cLock-2, clock2 U Bracket","21 , 99 Lei"
"Card de proximitate standard, cu orificiu pentru prindere la chei, XSF si W26, pentru cititoare Kantech, P10SHL","22 , 99 Lei"
"Buton de iesire aplicabil din otel inoxidabil, NO/COM SECUKEY Cbutton 4","22 , 99 Lei"
Telecomanda pentru Yala SX-12,"23 , 99 Lei"
"Buton aplicat verde pentru iesiri de urgenta, CPK-860A","24 , 99 Lei"
"Buton de iesire, aplicabil, aluminiu, NO/COM, SECUKEY Cbutton 3","24 , 99 Lei"
"Suport in forma de Z pentru montarea electromagnetilor YM-60, MBK-70Z","25 , 49 Lei"
Extensie cilindru 20MM pentru yale smart D1 si D1K D1ACC20mm,"25 , 99 Lei"
"Buton de iesire incastrabil, din inox, PBK-811A","25 , 99 Lei"
"Placuta cu releu pentru Normal Open/NC, Contact umed, temporizare ajustabila, PCB-505","26 , 99 Lei"
"Buton de iesire aplicabil din otel inoxidabil, NO/COM, SECUKEY Cbutton 1","27 , 99 Lei"
"Suport pentru usa compatibil cu clock3, de tip U, din metal, Clock3-U Bracket","27 , 99 Lei"
"Suport lung pentru incuietorile de tip strike DORCAS, DORCAS-LX-22","28 , 99 Lei"
"Suport Z si L pentru electromagnetul de 180Kgf cLock-2, cLOCK2 ZL BRACKET","29 , 99 Lei"
Carcasa pentru montarea aplicata a butoanelor PBK-800A,"30 , 99 Lei"
"Protectie pentru apa, BRS-02","32 , 99 Lei"
"Suport ZL pentru fixare electromagnet 280 kg, ACM-Y280ZL","34 , 99 Lei"
"Tag de proximitate, Mifare, DESFire 13.56 Mhz, Negru, AJAX TAG BL","34 , 99 Lei"
Set 10 bucati cu sticla de rezerva pentru modele CPK-860,"34 , 99 Lei"
"Tag de proximitate, Mifare, DESFire 13.56 Mhz, Alb, AJAX TAG WH","34 , 99 Lei"
"Suport L pentru electromagnet YM-180N(LED), MBK-180NL","35 , 99 Lei"
"Buton de iesire urgenta, SECUKEY Sbutton 10","36 , 99 Lei"
"Buton de iesire aplicabil, PBK-815","36 , 99 Lei"
"Suport pentru usa compatibil cu clock3, de tip ZL, din metal, Clock3-ZL Bracket","38 , 99 Lei"
"Buton de iesire, aplicabil, aluminiu, NO/COM, SECUKEY Cbutton 5","39 , 99 Lei"
"Releu 5Amperi, 45mA, NO/NC/COM Sebury BRB-01","39 , 99 Lei"
"Telecomanda suplimentara pentru kiturile de control acces WS2 si WS2K, WS2(K)Remote","39 , 99 Lei"
"Buton de iesire fara atingere, senzor infrarosu, LED de stare, montaj incastrat, din aluminiu, Sebury NBT-006","41 , 99 Lei"
"Buton de iesire incastrabil, din duraluminiu PBK-800A","41 , 99 Lei"
"Buton de iesire, aplicabil, aluminiu, NBT-001","41 , 99 Lei"
"Buton de iesire cu contact de tip NO / COM, 5-36V, Carcasa din Zinc, Argintiu, Sebury NBT-009","41 , 99 Lei"
"Buton de iesire cu contact de iesire de tip NO, 36V-3A, carcasa din aliaj de aluminiu, Sebury NBT-002","42 , 99 Lei"
"Buton de iesire cu infrarosu fara atingere, Indicator stare LED, Otel inoxidabil, NO/NC/COM, SECUKEY Cbutton 6","42 , 99 Lei"
"Buton de iesire incastrabil din inox, BD-EB08","43 , 99 Lei"
"Buton de iesire iluminat, FARA ATINGERE, detectie cu IR, 12V 3A, NO/NC/COM, carcasa din otel inoxidabil, Sebury NBT-005","44 , 99 Lei"
Cititor de proximitate EM RFID 125KHZ ACM26-EM,"44 , 99 Lei"
"Cititor de proximitate, RFID 125khz, control acces, ACM223-ID","45 , 99 Lei"
"Buton de iesire incastrabil, inox, PBK-810C","45 , 99 Lei"
"Electromagnet cu dimensiuni reduse, 60 kg forta, alimentare 12V 0.16A, potrivit pentru usi mici, ACM-Y60-12V","45 , 99 Lei"
"Buton de iesire incastrabil, din inox, led de stare VERDE, PBK-811A(LED)","46 , 99 Lei"
"Buton de iesire incastrabil, din inox, led de stare ROSU, PBK-811A(LED)","46 , 99 Lei"
"Buton de iesire incastrabil, din inox, led de stare Albastru, PBK-811A(LED)","46 , 99 Lei"
"Cilindru 70MM cu extensie pentru yale smart D1 si D1K, Secukey, KIT-D1C70mm","47 , 99 Lei"
"Tag de proximitate Ezviz, functie anti-copiere, 13.8-14.4MHz, viteza comunicare 106kbps, material ABS, CS-DL-IC-CPU-R200 (GR)","48 , 99 Lei"
"Cutie de plastic cu garnitura si presetupe, pentru conectare dispozitive electrice, surse si alimentatori, CUTIE225X311X130","48 , 99 Lei"
"Buton de iesire aplicabil, pentru exterior, SMB-S001","49 , 99 Lei"
Cititor de proximitate EM RFID 125KHZ ACM-26F-EM,"49 , 99 Lei"
"Modul de control acces cu Tastatura si Cititor de proximitate, RFID 125 KHZ, COD PIN, ACM226-ID","49 , 99 Lei"
"Suport ZL pentru montarea electromagnetilor SM-150LEDA, SB-150ZLLEDA","51 , 99 Lei"
"Cititor de proximitate, NFC, Mifare,13,56 Mhz, Wiegand 26, ACM-213NFC","52 , 99 Lei"
"Buton de iesire wireless, SECUKEY Wbutton 1","53 , 52 Lei"
"Economizor de electricitate, activare cu cartela, temporizare, material rezistent la foc, HLES-30A-PVC","54 , 99 Lei"
"Suport ZL pentru electromagnetul Clock 4, clock4-ZL Bracket","54 , 99 Lei"
"Sursa de alimentare 24V/1.5A, montaj pe sina DIN, Safer SAF-24-DIN1.5","58 , 99 Lei"
"Cilindru 90MM cu extensie pentru yale smart D1 si D1K, Secukey, KIT-D1C90mm","59 , 99 Lei"
"Buton de iesire, LED de semnalizare, montaj aplicat, IP56, aliaj de zinc, NO-COM, SMB-S001L","59 , 99 Lei"
"Cititor de proximitate RFID 125KHZ, KR-101E","59 , 99 Lei"
Contact magnetic din metal ND-MC424M,"59 , 99 Lei"
"Buton de iesire cu infrarosu fara atingere, Indicator stare LED, NO/NC/COM, SECUKEY Cbutton 7","59 , 99 Lei"
"Buton de incendiu conventional cu geam de sticla si fara capac, Tane SM-108","59 , 99 Lei"
"Buton de iesire cu touch, SECUKEY Sbutton 8","62 , 99 Lei"
"Buton de iesire cu touch, SECUKEY Sbutton 9","62 , 99 Lei"
Cititor de proximitate RFID 125KHZ KR-100E,"64 , 99 Lei"
"Amortizor pentru usi, 25-35KG, aluminiu, ACM-M59","64 , 99 Lei"
"Convertor de tensiune 14-28VAC la 12VDC, 1.5A, EV18-A2412","64 , 99 Lei"
"Buton iesire de urgenta aplicabil, cu 3 comutatoare NC-COM-NO, SCP-100-gn","65 , 99 Lei"
"Cititor de proximitate RFID 125 KHZ si COD, KR-102E","67 , 01 Lei"
"Modul de temporizare comanda, T-100R-1","67 , 99 Lei"
"Cititor RFID Id Card 125Khz Aplicat IP67, RS485 / Wiegand 26/34 Dahua ASR1200E-D","67 , 99 Lei"
"Cititor RFID Mifare Aplicat IP67, RS485 / Wiegand 26/34 Dahua ASR1200E","67 , 99 Lei"
"Electromagnet 60 KGf, Dimensiuni reduse 8 x 3 x 2 cm, Alimentare la 12 sau 24V, Aparent, SecuKey cLock-1","67 , 99 Lei"
"Lacat cu amprenta, suporta pana la 10 amprente, indicator LED, cu baterii, IP67, SECUKEY D11","68 , 99 Lei"
"Buton de iesire aplicabil din aliaj de zinc cu LED de semnalizare albastru, IP67, SMB-S001(LED)-bl","69 , 99 Lei"
"Buton de iesire aplicabil din aliaj de zinc cu LED de semnalizare verde, SMB-S001(LED)-gn","69 , 99 Lei"
"Yala electromagnetica incastrata scurta, REF1040G","69 , 99 Lei"
"Buton de iesire aplicabil din aliaj de zinc cu LED de semnalizare rosu, SMB-S001(LED)-rd","69 , 99 Lei"
"Cititior carduri si tag-uri Mifare potrivit pentur exterior, IP65, LED, Buzzer, Wiegand, ACM-26M-MF","69 , 99 Lei"
Suport ZL pentru fixare electromagnet MBK-180NZL,"69 , 99 Lei"
"Sistem blocare disc pentru biciclete, scutere si motociclete, Viro VIRO135","69 , 99 Lei"
"Yala electromagnetica cu buton sau cheie, aplicata, reversibila, ACM-Y041","71 , 99 Lei"
"Set manere cu clanta tubulara si buton fix drept, ax 90, rozete rotunde, YH-D90R","71 , 99 Lei"
"Sursa de alimentare 12V/2A, montaj pe sina DIN, Safer SAF-12V2A-DIN","71 , 99 Lei"
"Yala electromagnetica, 12-18V, cu cheie, metal, cu contraplaca, ACM-Y044","72 , 99 Lei"
"Electromagnet 180 Kgf SecuKey CLock-2, 12 / 24V, Aparent, 17x4x2cm","72 , 99 Lei"
Suport montare electromagneti 180kgf WATERPROOF la usi cu deschidere in interior,"73 , 99 Lei"
"Suport ZL aparent, pentru Electromagnet de 320 Kgf, Sebury, EM-320KG-LZ","73 , 99 Lei"
Yala electromagnetica incastrata lunga REF1040GL,"75 , 99 Lei"
"Suport ZL compatibil cu electromagnetul EM-180KG-A01G, carcasa din aliaj de aluminiu, Sebury EM-180-LZ","75 , 99 Lei"
"Cilindru 110mm cu extensie pentru yale smart D1 si D1K, Secukey KIT-D1C110mm","76 , 99 Lei"
Suport ZL pentru fixare electromagnet 350KGF ACM-Y350ZL,"79 , 99 Lei"
Cititor de proximitate MIFARE 13.56MHz pentru centrale de control acces KR-101M,"79 , 99 Lei"
"Buton de apelare Y-A1-CALL, Wireless, pentru spital/ hotel","79 , 99 Lei"
Suport in forma de Z si L pentru montarea electromagnetilor de 280kgf,"79 , 99 Lei"
"Sursa de alimentare 12Vcc/2A, montaj pe sina DIN DR12024-01C","79 , 99 Lei"
"Buton wireless Y-A1-CANCEL, pentru anularea apelului, 433MHz, compatibil cu Y-A1-CALL","79 , 99 Lei"
"Amortizor hidraulic cu brat pentru usi de 25-45kg, cu blocare, SA-5012AD-sv","79 , 99 Lei"
"Suport de tip LZ pentru electromagnetul de 280 KgF Sebury, EM-280LZ","79 , 99 Lei"
"Electromagnet pentru control acces, forta de retentie 280kgf, 12v sau 24v, Zinc, Placa inclusa, Secukey cLock 3","81 , 99 Lei"
"Yala electromagnetica cu buton, aplicata, reversibila, ACM-Y042","81 , 99 Lei"
"Statie de apelare cu fir Y-SC, pentru Hotel sau apelare personal medical in spatale","82 , 99 Lei"
"Suport ZL pentru fixare electromagnet YM-280N(LED), MBK-280NZL","84 , 99 Lei"
"Sursa de alimentare 12V/5A, montaj pe sina DIN, Safer SAF-12-DIN5-P","87 , 99 Lei"
"Cititor pentru carduri de 125KHz cu cip EM4100 pentru carduri ABK- 2000/1000/1001EM, IDR-C2EM-SA","87 , 99 Lei"
"Suport Z si L pentru electromagnetul DS-K4H258S, pentru usi metalice, PVC sau lemn, Hikvision DS-K4H258-LZ","87 , 99 Lei"
Buton de iesire cu infrarosu,"87 , 99 Lei"
"Buton de iesire incastrabil cu infrarosu si temporizare, index de protectie IP66, LED de stare, SECUKEY, Ebutton 1-X","89 , 99 Lei"
"Amortizor hidraulic pentru usi, 35-60kg, aluminiu, ACM-M60","89 , 99 Lei"
"Buton de panica wireless portabil, cu pandantiv si bratara Y-DS1(KIT), 2x baterii CR2016 3V, IP56","89 , 99 Lei"
"Minielectromagnet aplicabil de 60kgf, YM-60N","89 , 99 Lei"
"Controler acces standalone, card RFID 125 kHz, PIN, tastatura iluminata, wiegand 26 in/out, negru, Silin, SK-30EM-B","92 , 99 Lei"
"Buton de iesire incastrabil cu infrarosu si temporizare, index de protectie IP66, LED de stare, SECUKEY, Ebutton 2-X","92 , 99 Lei"
"Bolt electric, fail safe, 800 kgf, NC/COM/NO, temporizator, 12V, 5 fire, SECUKEY, C-Strike 9","93 , 99 Lei"
"Buton aplicabil cu cheie, sistem revenire automata, contact de tip NO si NC, 16A 240V, pentru interior, negru, YKS-803D2","95 , 99 Lei"
"Sursa de alimentare 12V/5A, montaj pe sina DIN, Safer SAF-12-DIN5-UPS","97 , 99 Lei"
"Yala electromagnetica incastrabila Fail - Secure de tip strike, DORCAS-41AAF","98 , 99 Lei"
Buton de apel wireless fix pentru perete Y-SW2,"99 , 00 Lei"
"Electromagnet incastrabil, 150kg forta, Yli, SM-150MA","99 , 99 Lei"
"Yala electromagnetica UNIVERSALA aplicabila cu memorie mecanica, SX-09","99 , 99 Lei"
"Yala electromagnetica incastrabila, Fail-Safe, 12V, forta retinere 800KgF, Yli YS-132NC","99 , 99 Lei"
"Yala electromagnetica aplicabila cu memorie mecanica, SX-08E, deschidere exterior","101 , 99 Lei"
"Yala electromagnetica reversibila, 24Vcc, incastrabila, simetrica DORCAS-54N524F","101 , 99 Lei"
"Yala electromagnetica aplicabila cu memorie mecanica, SX-08I, deschidere interior","101 , 99 Lei"
"Electromagnet 150kg forta, cu monitorizare si led, aplicabil, SM-150LEDA","102 , 49 Lei"
"Bolt electric, fail safe, NC/COM/NO, temporizator, 12V, SECUKEY, C-Strike 2(SDT)","102 , 99 Lei"
"Economizor de electricitate - cartele EM4100 si TEMIC, Yli, HLES-30A-EMTM","105 , 99 Lei"
"Suport inoxidabil Z si L compatibil cu electromagnetii YM-350, MBK-350ZL","106 , 99 Lei"
"Minielectromagnet de 70kgf cu monitorizare, YM-70N-S","106 , 99 Lei"
"Suport “ZL” pentru montarea electromagnetilor de 350 kgf la usi cu deschidere spre interior, MBK-350NZL","106 , 99 Lei"
"Buton aplicabil cu cheie, sistem revenire automata, contact de tip NO si NC, 16A 240V, pentru interior, Alb YKS-803D1-WH","106 , 99 Lei"
Cititor de proximitate RFID Mifare 13.56MHz si COD KR-102M,"108 , 52 Lei"
"Cititor cu USB pentru taguri si cartele, MIFARE 13,56MHz, IDR-C2MF-SA","108 , 99 Lei"
"Set de manere cu clanta tubulara, buton fix drept, shield intreg, interax 90 mm, YH-D90L-90","109 , 99 Lei"
"Yala electromagnetica incastrabila, ajustabila, Fail secure, NO, 8-12V, DORCAS-41AaDF","109 , 99 Lei"
"Buton de panica wireless pentru pacienti, functie de apelare si anulare, Y-FS2-WR","109 , 99 Lei"
"Amortizor usa hidraulic, 45-75kg, inchidere automata, ACM-M61","109 , 99 Lei"
Cititor proximitate IP65 Mifare 13.56 Mhz Hikvision DS-K1802M,"109 , 99 Lei"
"Buton de iesire aplicabil, infrarosu si temporizare, LED de stare bicolor, K40B-W","109 , 99 Lei"
"Suport de tip Z si L pentru electromagnetul Clock 5, cLock5-Bracket","109 , 99 Lei"
Cititor proximitate IP65 EM 125KHZ Hikvision DS-K1802E,"109 , 99 Lei"
"Sursa de alimentare industriala 60W, 24V, 2.5 A, Meanwell MDR-60-24","110 , 99 Lei"
"Amortizor hidraulic cu brat pentru usi de 40-65kg, cu blocare","112 , 99 Lei"
"Bolt electric, fail safe, 800 kgf, NC/COM, temporizator, 12V, 4 fire, SECUKEY, C-Strike 7","114 , 99 Lei"
"Amortizor hidraulic cu brat pentru usi cu greutate intre 40 - 65 kg, SA-6033AW-wh","114 , 99 Lei"
Cititor cartele/Taguri EM125Khz Mhz cu tastaura Hikvision DS-K1801EK,"114 , 99 Lei"
"Buton de iesire cu Bluetooth, aplicatie mobila, 86x86x12, Sebury S-PAD-BT","114 , 99 Lei"
"Electromagnet pentru control acces, retentie pana la 350 KGf, 12 sau 24V cc, Secukey CLock4","115 , 99 Lei"
"Control acces Stand Alone cu tastatura iluminata si cititor pentru carduri Mifare 13.56Mhz, Pentru exterior IP68, Wiegand 26, Metal, ACM-208-MIFARE","115 , 99 Lei"
Cititor cartele/Taguri Mifare 13.56 Mhz cu tastaura Hikvision DS-K1801MK,"115 , 99 Lei"
"Controler acces standalone cu telecomanda, card RFID 125 kHz, NO-COM-NC, Silin, S2-EM","116 , 99 Lei"
"Sursa de alimentare cu temporizare 12V 3A, ABK-901-12-3","116 , 99 Lei"
"Yala electromagnetica cu buton, aplicata, de stanga, SX-11L","117 , 99 Lei"
"Yala electromagnetica cu buton, aplicata, de dreapta, SX-11R","117 , 99 Lei"
"Bolt electric, fail safe, NC/COM/NO, temporizator, 12V, SECUKEY C-Strike 3","119 , 99 Lei"
"Zavor de aplicare, din otel si alama, 1.7833.0714","119 , 99 Lei"
"Buton de iesire cu senzor, IP66, SECUKEY Sbutton 100","119 , 99 Lei"
"Buton de panica wireless, functie de apelare si anulare, 433.92 MHz, distanta de comunicare 300m, Y-FS2-WR-D","119 , 99 Lei"
"Electromagnet aplicabil de 180kg, EM-180KG-A01G","119 , 99 Lei"
"Sistem de control acces stand alone, RFID, IP68 1000 de utilizatori, ACM-208C","119 , 99 Lei"
"Bolt electric, fail safe, NC/NO/COM, temporizator, 12V, 1500 kgf, SECUKEY, C-Strike 5","120 , 99 Lei"
"Yala incastrata scurta VIRO Italia Reversibila, 7755S","122 , 99 Lei"
"Yala incastrata lunga VIRO Italia Reversibila, 7755L","122 , 99 Lei"
"Cititor de proximitate, RFID 125khz, Wiegand 26/34, 12V, KR-611E","123 , 99 Lei"
"Cititor de carduri stand-alone 125 kHz RFID, SECUKEY-E1","125 , 99 Lei"
"Bolt electric, fail safe, NC/COM, temporizator, 12V, SECUKEY, C-Strike 4","126 , 00 Lei"
"Sursa de alimentare cu backup liniara 12V 3A, carcasa otel, temporizator 15 sec ACM-806","129 , 99 Lei"
"Buton de iesire pentru exterior cu infrarosu, fara atingere, carcasa din aluminiu, 73x20mm, LED stare, 3-10 cm, Secukey Sbutton 100-X","129 , 99 Lei"
"Modul releu I/O securizat Rosslare MD-25TB, compatibil cu cititoare convertibile (AYC), 12V, indicatori LED","129 , 99 Lei"
"Lacat cu cod, suporta pana la 10 parole, indicator LED, cu baterii, IP67, SECUKEY D10","129 , 99 Lei"
Amortizor VIRO ZIP fara blocare max 85KG 116.13.1.212,"129 , 99 Lei"
"Electromagnet 180 KGf pentru usa dubla, Dimensiuni reduse 17L x 4W x 2H cm, Alimentare la 12 sau 24V, Aparent, SecuKey cLock-2D","129 , 99 Lei"
"Amortizor VIRO ZIP brat reglabil, forta reglabila, max 85KG, blocaj 90 grade","129 , 99 Lei"
"Bolt electric, fail secure, 1500 kgf, NC/NO/COM, temporizator, 12V, 6 fire, SECUKEY, C-Strike 6","130 , 99 Lei"
Control acces standalone o usa unidirectionala S-BOARD,"131 , 99 Lei"
"Amortizor hidraulic cu brat, pentru usi de 60-85kg, argintiu SA-5044AW-sv","133 , 99 Lei"
"Buton de panica wireless, distanta de transmisie 300m, 12V, functia de apelare si anulare, YLI Y-FS2-WR-H","133 , 99 Lei"
"Controler acces standalone cu telecomanda, card Mifare 13.56 kHz, NO-COM-NC, Silin, S2-MF","134 , 99 Lei"
Sursa de alimentare pentru control acces cu Backup YP-904-12-3-B,"134 , 99 Lei"
"Sursa de alimentare neintreruptibila 24V-2,5Ah cu montare pe sina DIN, DR24060-02B","135 , 99 Lei"
Buton de apel urgenta fix si mobil wireless Y-SW-G33,"139 , 99 Lei"
Sistem de control acces standalone pentru o usa Q3,"139 , 99 Lei"
"Suport pentru montare de tip ZL pentru electromagnetul Sebury de 500 KgF, EM-500KG-LZ","139 , 99 Lei"
"Cititor de proximitate, RFID 125 KHz, Slim, Sebury, 1EH-reader","140 , 99 Lei"
Electromagnet pentru usi antifoc cu deblocare manuala YD-604,"141 , 99 Lei"
"Cititor de proximitate RFID 125Khz cu tastatura integrata, IP65, Hikvision DS-K1802EK","142 , 99 Lei"
"Electromagnet Ascuns 280 KgF, 12V, 250xW48xH27, Sebury EM-280KG-A01","142 , 99 Lei"
"Cititor de proximitate Mifare, cu tastatura HIKVISION, DS-K1802MK","142 , 99 Lei"
"Incuietoare electromagnetica aplicata pentru usi de vestiar, YE-305NC","144 , 99 Lei"
"Buton de iesire pentru persoane cu dizabilitati, LED bicolor, NO-COM-NC, PBK-871(LED)","145 , 99 Lei"
"Cititor de card RFID cu cod PIN, conexiune Wiegand, ACM-28A-EM","145 , 99 Lei"
"Cititor de carduri stand-alone, 125 kHZ RFID, Secukey S7-EM","146 , 99 Lei"
"Control acces incorporat SECUKEY, RFID 125KHz EM, Wiegand, NO/NC/COM Afisaj LED, IP66, SECUKEY-E2","146 , 99 Lei"
"Controler de acces cu cartele de proximitate EM/MF si comunicatie Wiegand, SECUKEY S2-X EM+MF","146 , 99 Lei"
"Control acces RFID 125KHz EM + PIN, Wiegand, NO/NC/COM, Alarma anti-manipulare, IP66, SECUKEY-EK2","146 , 99 Lei"
Yala electromagnetica aplicabila cu motor si senzor magnetic SX-10,"146 , 99 Lei"
"Sistem de control acces standalone, PIN, card 125Khz, tastatura touch iluminata, Wiegand, SECUKEY, SECUKEY-EH3","146 , 99 Lei"
"Cititor control acces standalone cu tastatura, SECUKEY-K7","148 , 99 Lei"
"Control acces standalone Secukey CH3, taste touch, card Mifare si RFID, sonerie, Wiegand, IP66","149 , 99 Lei"
Cititor proximitate RFID 125KHZ IP65 PRO-ID10-EM-WG,"149 , 99 Lei"
"Sistem de control acces RFID + Cod 1000 utilizatori Sebury Mkey, MKEY","149 , 99 Lei"
"Cititor RFID Mifare 13,56 Dahua ASR1100A conexiune RS485","149 , 99 Lei"
"Bolt electromagnetic 1000kg, 12 sau 24V, temporizare 0, 3, 6s, SB-150ST","149 , 99 Lei"
Economizor de energie pentru sistem hotelier,"149 , 99 Lei"
"Sursa de alimentare pentru control acces, BPS-07-5","151 , 99 Lei"
"Cititor cartele de proximitate cu tastatura pentru centrale de control acces, KR-612E","152 , 99 Lei"
"Convertor RS232/RS485 Rosslare MD14-001, pentru centralele AC-115, AC-215, AC-225","152 , 99 Lei"
"Electromagnet pentru control acces 320 KgF, 240x56.5x29, EM-320KG-A01GD","153 , 99 Lei"
"Cititor de proximitate RFID cu cod MIFARE 13.56MHz, pentru centrale de control acces KR-611M","153 , 99 Lei"
"Control acces cu cod si card 125KHz EM, Alarma anti-manipulare, Sonerie, IP66, SECUKEY-K9","154 , 99 Lei"
"Cititor proximitate Mifare 13.56 Mhz, IP65, Hikvision DS-K1107AM","155 , 99 Lei"
"Cititor de proximitate Mifare 13.56MHz, Wiegand, RS-485, IP66, Dahua ASR2100A","155 , 99 Lei"
"Electromagnet aplicabil, 280 kgf, 12V, Hikvision, DS-K4H258S","158 , 99 Lei"
"Sistem blocare disc pentru biciclete, motorete si motociclete, Blindato Extreme, ViroVIRO152.47.","159 , 99 Lei"
"Sistem blocare disc pentru biciclete, motorete si motociclete, Viro VIRO166.9","159 , 99 Lei"
"Modul de extensie Access Control, Dahua DEE1010B-S2","160 , 99 Lei"
Incuietoare orizontala stadalone pentru usi vestiare si dulapuri TKD-910,"161 , 99 Lei"
Incuietoare verticala standalone usi de vestiare sau dulapuri TKD-810,"161 , 99 Lei"
Bolt electric de inalta siguranta cu actiune magnetica YB-100,"163 , 99 Lei"
"Electromagnet aplicabil 180kgf cu LED de stare, YM-180N(LED)","164 , 99 Lei"
Amortizor hidraulic cu sina si blocaj pentru usi de 40-65kg SA-8023-sv,"166 , 99 Lei"
Cititor cartele/Taguri Mifare 13.56 Mhz Hikvision DS-K1102AM,"166 , 99 Lei"
"Cititor de proximitate pe 2 frecvente (EM4100 125KHz si MIFARE 13.56MHz), KR-300DUAL","168 , 99 Lei"
"Control acces mini, Card Mifare 13.56MHz, Bluetooth, Aplicatie mobila, IP66, SECUKEY S7-BTCard+PIN","168 , 99 Lei"
"Modul de control access cu doua relee, functioneaza cu orice cititor Wiegand 26-37 bit S-BOARD2","169 , 99 Lei"
"Cititor de proximitate Mifare 13.56MHz, Wiegand, RS-485, IP66, Dahua ASR2200A","169 , 99 Lei"
"Cititor de proximitate EM 125kHz, Wiegand, RS-485, IP66, Dahua ASR2200A-D","169 , 99 Lei"
"Sursa de alimentare cu backup liniara 12V 2A, ABK-902-12-3","169 , 99 Lei"
Amortizor hidraulic cu sina pentru usi de 40-65kg Alb cu blocare SA-8023W,"169 , 99 Lei"
Cititor proximitate Mifare 13.56 Mhz IP65 PRO-ID10-MF-WG,"169 , 99 Lei"
"Mini controller Secukey Sboard-III WiFi, 1 releu, compatibil cu aplicatia Tuya","169 , 99 Lei"
"Smart Gateway pentru Control Acces, Wi-Fi, Bluetooth, 5V 1A, compatibil cu Tuya, SECUKEY Gateway-Secukey","169 , 99 Lei"
"Sistem de control acces standalone de exterior pentru o usa, BC2000","169 , 99 Lei"
"Suport “ZL” pentru fixarea electromagnetilor YM-280ND(LED), MBK-280NDZL","170 , 99 Lei"
"Suport GZ compatibil cu electromagnetii YM-280N, montare pe usi de sticla, MBK-280NGZ","174 , 99 Lei"
"Economizor de electricitate pentru pensiuni si hotel, pentru carduri Mifare cu cip Adel S50, 220V 30A, HLES-30A-MIFARE-A(K)","174 , 99 Lei"
"Yala electromagnetica aplicata VERTICAL, SX-96","175 , 99 Lei"
"Terminal de control acces standalone cu Tastatura, PIN + card Mifare 13.56 Mhz, Hikvision DS-K1T801M, 3000 utilizatori, Memorie, Led, Beep","176 , 99 Lei"
Yala aplicata de exterior 12V Nadal Badal dreapta 1913D,"176 , 99 Lei"
"Control acces mini, Card 125KHz EM, Bluetooth, Aplicatie mobila, SECUKEY K7-BT PIN+Card","177 , 99 Lei"
"Electromagnet pentru retinere usa deschisa, 50 kgf, 12/24 V, YD-605","179 , 99 Lei"
"Cutie metalica pentru alarme sau control acces, cu transformator 16V / 18V, Pulsar AWO 000EI","179 , 99 Lei"
Yala aplicata de exterior 12V Nadal Badal stanga 1913S,"179 , 99 Lei"
"Sursa de alimentare 21.6 ~ 29Vcc 1.5A (36W), cu separator de alimentare, PC7","179 , 99 Lei"
Control acces standalone 1000 utilizatori Sebury K2,"179 , 99 Lei"
"Yala electromagnetica cu bolt ajustabil, reversibil, Fail Safe, Dimensiuni reduse, 12V, DORCAS-41-2-N512F","185 , 99 Lei"
