Product,Price
"Poarta Batanta Bidirectionala, mecanica, din INOX, cu cheie, YK-PB-M-ZL","3002 , 99 Lei"
"Control acces cu recunoastere faciala, camera de 2MP, ecran LCD, 6000 utilizatori, monitorizare temperatura, Dahua ASI6213J-FT1","3210 , 99 Lei"
"Turnichet semiautomat, bidirectional din inox BXT-120S","Disponibil
la comanda"
"Poarta batanta unidirectionala, mecanica cu arc, YK-PB-M-L-A","3799 , 99 Lei"
Turnichet semiautomat bi-directional Inox TR601,"4068 , 99 Lei"
"Centrala pentru control acces, TCP/IP, 2 usi bidirectionale sau 4 usi unidirectionale, Rosslare, AC-425IP-BE","4115 , 99 Lei"
"Poarta pentru acces persoane, deschidere bidirectionala, YK-PB2044(V3)","4299 , 99 Lei"
"Software VMS pentru gestionarea echipamentelor IP Dahua, LPR, control Acces, Alarma, Video, DSS Profesional","4499 , 99 Lei"
"Turnichet tripod bidirectional, brate metalice, Hikvision, DS-K3G411LX-R-Dm55","4585 , 99 Lei"
"Turnichet monopod semi-automat, inox, 28ppm, YK-TT122S","4599 , 99 Lei"
"Turnichet tripod semiautomat, bidirectional, YK-TS1000-PRO","4616 , 99 Lei"
"Soft profesional de pontaj ZKTime pentru aparatele ZkSoftware, 250 angajati, ZKTIME.ENT250","4757 , 99 Lei"
"Poarta pentru detectie metale 6 detectori, alarma afisaj, contor, pentru interior, ARS-300/800A/6","4789 , 99 Lei"
"Turnichet tripod Hikvision, bidirectional, indicator LED, brat metalic, DS-K3G501LX-R-Dm55","4901 , 99 Lei"
Aplicatie pontaj pentru lucru de acasa ZKBioTime Mobile APP,"4999 , 00 Lei"
"Turnichet semiautomat tip Bridge, bidirectional BXT-110S","Disponibil
la comanda"
Poarta acces persoane inox birectionala automata YK-STB1000,"5055 , 99 Lei"
"Turnichet Full Automatic monopod YK-TT111, Fail safe, IP44, 80KG/brat","5267 , 99 Lei"
Turnichet INOX bidirectional complet automat YK-TT122,"5279 , 99 Lei"
Poarta detectie metale 18 de zone ARSENAL-600T.S/18,"5799 , 99 Lei"
Turnichet electromecanic bidirectional INOX YK-TT112S,"5999 , 99 Lei"
Poarta detector de metale pietonal 6 zone ARSENAL-300T/6,"5999 , 99 Lei"
"Soft profesional de pontaj ZKTime pentru aparatele ZkSoftware, 500 angajati, ZKTIME.ENT500","7210 , 99 Lei"
Turnichet dublu semiautomat bidirectional Inox TR601-M,"7429 , 99 Lei"
"Turnichet semi automat cu centrala , 2 cititoare RFID, licenta si soft inclus","8934 , 99 Lei"
"Poarta batanta pentru acces persoane, cititor mifare, brat otel, latime banda 1100mm, Hikvision, DS-K3BC411X-M-Dm110","12843 , 99 Lei"
"Extensie turnichet bi-directional deschidere rapida cu pasaj 800mm, TS-SG801-M-800","14792 , 99 Lei"
"Turnichet motorizat bi-directional deschidere rapida cu pasaj 800mm, TS-SG801-800","18999 , 99 Lei"
"Poarta de acces de tip turnichet vertical, inaltime 2.3m, IP54, bidirectional, Boomx YK-TV539","Disponibil
la comanda"
"Turnichet de acces bidirectional, rotativ, otel rezistent la coroziune, ZKTeco, FHT2300-316","45679 , 99 Lei"
"Turnichet inalt dublu electromecanic rotativ bidirectional semi-automat, YK-TV535-2","Disponibil
la comanda"
