Product,Price
"Eticheta pentru detectori de fum Teknim, TFA-0121",2.49
"Protectie transparenta pentru buton de incendiu, TEKNIM TFA-0165",4.99
"Capac pentru buton de incendiu Inim EC0020 / IC0020, WCP0020",6.99
"Soclu pentru detectori adresabili sau conventionali TEKNIM, TFA-0120",8.99
"Doza de montaj module antiincendiu, Bentel, FC470DGB",10.99
"Baza de montare pentru detectori Inim Enea si Iris, EB0030, 4 intrari, pentru teava de 16 mm",10.99
"Baza pentru detectori adresabili si conventionali Teknim TFA-0120A, culoare antracit",12.99
Soclu pentru detectorii adresabili si conventionali Inim EB0010,13.99
"Rezerva de plastic deformabila, compatibila cu butoanele din seria FC400, FC400RD",13.99
Indicator optic pentru senzori de fum montati in tavan casetat RI31,14.99
"Soclu pentru relee RS/PT5, 24V, terminale cu surub, 14 poli, 10A, Schrack, YRS50004",14.99
"Soclu standard pentru detectorii conventionali Unipos, DB8000",15.19
"Soclu universal pentru senzori FIRECLASS, 5B",15.99
"Soclu izolator standard Fireclass, FC4B",15.99
Soclu detector adresabil Detnov Z-200,15.99
"Capac pentru doza de montaj module centrala de incendiu, FC470CV",16.99
"Baza pentru montaj aparent buton Morley-IAS, culoare rosie - Honeywell PS031W",17.99
Soclu pentru detectori Morley-IAS - Honeywell MI-B501AP-IV,20.99
"Sticla butoane alarmare incendiu, set de 10 buc. Morley-IAS - Honeywell MUS156",23.99
DOZA BUTON ADRESABIL FC420CPB,23.99
"Releu PT 6A 4C 24VDC, Schrack, PT570024",24.99
"Detector gradient de temperatura UNIPOS, FD8020",27.99
"Soclu detectori adresabili Unipos, DB7100",28.99
Buton de incendiu conventional ROSU SIR EM200RS,29.99
"Soclu cu iesire pe releu pentru detector de fum Unipos, DB8000R",34.99
"Adaptor montaj aparent detectoare Morley-IAS, orificiu 22mm, 1 buc, culoare Ivory - Honeywell SMK400EAP-IV",34.99
Indicator acustic pentru senzori montati in tavan Unipos RI31S,34.99
"Indicator LED pentru alarme de incendiu, LED rosu, 10-32VDC, IP30, TEKNIM TFA-1196",34.99
Indicator luminos pentru sisteme adresabile Inim IL0010,35.99
"Baza pentru detectoare wireless Morley-IAS, culoare alb - Honeywell B501RF",36.99
"Baza pentru detectoare wireless Morley-IAS, culoare rosu - Honeywell B501RF-RR",36.99
"Senzor de fum Standalone SD218, baterie 9V",39.99
"Detector de fum optic Unipos, FD8030",39.99
"Detector de prag fix de temperatura, Unipos 8010",39.99
Lampa Emergenta EXIT JOS LED 3W cu acumulator BR-BC14-00753,39.99
Indicator paralel detectoarele Morley-IAS - Honeywell INDICATOR,41.99
"Detector de fum, conventional, optic, TEKNIM, TFD-4230",41.99
"Corp iluminat de urgenta cu LED, 3W, 80lm/160lm, lumina rece (6400K), cu baterie Li-Ion 3,7V, 1000mAh, IP20, 2 pictograme, Vivalux VIV004032",41.99
"Releu DPDT, 8A, 24VDC, 40 Finder 40.52.9.024.000",41.99
"Lampa de semnalizare Detnov PAD-10, LED, IP42",42.99
"Tub de prelevare 12"" cu gauri pentru DNRE, Morley-IAS - Honeywell DST1",42.99
"Buton de incendiu conventional, indicator LED, NC/NO, rezistenta interna 470 Ohmi, TEKNIM TFB-3167",42.99
"Buton de incendiu conventional, resetabil, TEKNIM, TFB-3165",44.99
"Soclu izolator Fireclass, FC4B-I",46.99
"Lampa Emergenta EXIT DREAPTA/STANGA LED 3W cu acumulator, BR-BC14-00653",46.99
"Detector combinat de fum si caldura, optic, conventional, Teknim, TFD-4250",47.99
"Sursa de alimentare in comutatie 24V 5A, Safer SAF-39PA",48.99
"Buton de incendiu conventional resetabil, 5-30VDC, Contact NC/NO, IP30, albastru, TEKNIM TFB-3165B",49.99
"Lampa de semnalizare cu stroboscop, LED ROSU, FIRECLASS, RILED",49.99
Detector de fum conventional cu soclu inclus universal SD119-2,49.99
"Buton de incendiu conventional rosu cu sticla Unipos, FD3050",49.99
Detector de fum stand alone 85dB/m baterie 9V inclusa,49.99
"Buton de incendiu conventional, NO/NC, 5-30VDC, rezistenta interna 470 ohmi, TEKNIM, TFB-3165Y",49.99
"Lampa Emergenta EXIT LED 3W cu acumulator, BR-BC14-00553",49.99
"Carcasa din plastic IP65 pentru instalarea modulelor Inim, FBOX100",51.99
"Baza cu adancime mica - rosie, set de 5 buc. - Honeywell CSR",51.99
Cutie montaj modul I/O Morley-IAS - Honeywell M200E-SMB,54.99
"Baza incastrata pentru echipamentele AV, cu garnitura, montaj la exterior, culoare rosie, Morley-IAS - Honeywell WRR",57.99
"Detector de caldura wireless X-Sense XH02-M, alarma 85dB, control din aplicatie, compatibil cu centrala SBS50",57.99
"Detector de temperatura Conventional, Fireclass, FC702H",58.99
Soclu detector cu releu pentru seria 600 FIRECLASS MUB-RV,58.99
"Detector temperatura si crestere temperatura, conventional, Fireclass 601HR",58.99
"Detector fum Smartwise SMOPRO-RF-R2, 433MHz",59.99
"Detector de temperatura si fum conventional TEKNIM, TFD-3250",59.99
"Buton de incendiu conventional cu geam de sticla si fara capac, Tane SM-108",59.99
"Detector de temperatura conventional, Fire Class, FC701H",61.99
"Sirena pentru incendiu tip clopot, WIZMART NB-560",66.99
"Sirena conventionala de interior cu flash, UNIPOS FD8204CS",67.99
Soclu FC43X-SSBR de montare pentru sirena FC440SR,68.99
Senzor optic de fum conventional seria Iris INIM ID100,69.99
"Sursa de alimentare in comutatie 24V 15A, Safer SAF-41PA",69.99
"Detector inteligent temperatura adresabil TEKNIM, TFD-1260",69.99
Detector fum optic si crestere temperatura Unipos FD8060,69.99
Detector de fum optic 701P,69.99
"Lampa emergenta 4W 3 - 7H, 6500K, 330lm, BR-BC01-00330",71.99
Buton de incendiu conventional rosu Inim IC0020,71.99
Detector adresabil cu prag fix de temperatura Unipos FD7110,76.99
"Buton de incendiu conventional, rosu, plastic, FIRECLASS MCP200CS",78.99
"Corp iluminat Emergenta 3H, 1W, HIDRANT, Atra 3120",78.99
"Lampa LED EXIT, 1.8W, 30lm, lumina rece (6500K), cu baterie Li-Ion, 3.7V, 600mAh, IP20, Vivalux, VIV004031",79.99
"Soclu pentru detectori adresabili TEKNIM, cu buzzer, TFM-1281",79.99
Detector adresabil crestere temperatura Unipos FD7120,79.99
"Detector conventional de fum si de temperatura, Fireclass FC701PH",80.99
"Corp iluminat Emergenta 3 ORE, 3W EXIT, 3115",82.99
"Sirena conventionala de interior cu alarma stroboscopica, TEKNIM TFS-3193W",83.99
Senzor optic de fum si temperatura conventional seria Iris INIM ID300,84.99
"Centrala X-Sense SBS50 pentru dispozitive de alarma wireless, detectare fum, caldura, CO, control din aplicatie",84.99
"Detector optic de fum adresabil TEKNIM, TFD-1250 Certificat EN 54-7",84.99
"Sirena de interior conventionala cu iluminare stroboscopica TEKNIM, TFS-3192R",84.99
"Sirena conventionala, de interior cu avertizare luminoasa TEKNIM TFS-3191",84.99
"Modul pentru sistem de antiincendiu, convertor tensiune de la 24V la 14V, curent maxim 1A, compatibil cu sirena IVY-R, Inim STD241201",85.99
"Detector inteligent temperatura adresabil cu izolator incorporat, TEKNIM TFD-1261",89.99
"Modul adresabil inteligent pentru centrale detectie la incendiu TEKNIM, TFM-1011",89.99
"Detector combinat de fum si caldura, 12V, 4 contacte, inclusiv baza, SNC-300-CR",89.99
"Detector de fum programabil WIFI, notificari direct pe telefon, RH-ASK02",89.99
Detector fum de tigara standalone SD-20B8 baterie 9V,89.99
"Sirena conventionala cu alarma cu avertizare luminoasa (alba), TEKNIM TFS-3192W",92.99
"Flash conventional de interior stroboscopic(Avertizare luminoasa stroboscopica), fara sunet, Rosu, TEKNIM TFS-3193R",92.99
Buton de incendiu conventional albastru Inim IC0020B,94.99
"Detector de fum adresabil SNA-360-S2 certificat EN54-7, Numens SNA-360-S2",99.99
Detector de temperatura adresabil HNA-360-H2 certificat EN54-7,99.99
"Detector de gaz metan adresabil TEKNIM, TFD-1170",99.99
"Cablu pentru programator TEKNIM TFCM-1801, TEKNIM TFCM1801-CABLE",99.99
"Buton adresabil de alarmare incendiu UNIPOS, FD7150N",99.99
"Detector de fum Morley-IAS cu izolator, culoare Ivory - Honeywell HM-PSE-I",101.99
"Detector adresabil de fum optic Unipos, FD7130",104.99
"Detector inteligent fum si/sau temperatura adresabil TEKNIM, TFD-1270",104.99
Detector de temperatura fixa 58°C cu izolator HoneyWell HM-FHSE-I-AP,108.99
"Detector rata de crestere temperatura Morley-IAS cu izolator, culoare Ivory - Honeywell HM-RHSE-I-AP",108.99
"Pachet corp de iluminat de siguranta cu led 2W si folie pt emergenta hibrant, Braytron BC14-01100Hidrant",108.99
"Detector de fum adresabil TEKNIM TFD-1251, cu izolator, indicator LED, IP30",109.99
"Senzor de fum WisuAlarm Dahua HY-SA30A, standalone, alarma 85 dB, montaj pe tavan",109.99
"Corp iluminat de siguranta cu LED 2W si folie de siguranta STANGA / DREPATA, Braytron BC14-01100-USA-DR-ST",109.99
"Sursa comutatie 24V 1,6AH, 50W, cu incarcare baterie MEAN WELL SCP-50-24",115.99
"Detector de fum wireless WisuAlarm Dahua HY-SA30A-R8, alarma 85dB, indicator LED, sistem MESH, baterie 3V CR123A, HY-SA30A-R8",118.00
"Corp de iluminat cu LED, 5W, 3.7V, 2200mAh, baterie Li-ion, lumina rece (6400K), IP65, Vivalux Castor VIV004116",119.99
"Buton de incendiu adresabil TEKNIM, TFB-1166",119.99
Detector de temperatura FIRECLASS FC460H,128.99
Detector de gaz metan 230V cu releu OR-DC-614,129.99
"Multi detector adresabil Teknim TFD-1271, cu izolator incorporat, 2x indicator LED, IP30",129.99
"Detector adresabil de fum si prag de temperatura Unipos, FD7160",129.99
Sirena conventionala de incendiu INIM 32 tonuri 106dB,129.99
"Pachet corp iluminat de siguranta cu LED 5W si folie PT dreapta, Braytron BR-BC14-00900-USA-DR",129.99
"Detector de fum si temperatura adresabil HNA-360-C2 certificat EN54-7, Numens HNA-360-C2",129.99
"Detector de gaz metan conventional TEKNIM, TSD-701",129.99
"Detector de FUM adresabil FIRECLASS, FC460P",131.99
Sirena conventionala de incendiu pentru interior / exterior AH-03127-S,132.99
"Multi detector adresabil Teknim TFD-1271A, cu izolator incorporat, 2x indicatori LED, culoare antracit",134.99
"Lampa de avertizare adresabila cu lumina alba, izolator incorporat, 15-32VDC, material antiinflamabil UL94, TEKNIM TFS-1183W",134.99
"Detector de fum optic si termic, Morley-IAS, adresabil, cu izolator, Honeywell HM-PTSE-I-AP",136.99
Detector optic de fum adresabil protocol Enea cu izolator inclus Inim ED100,139.99
"Lampa de avertizare adresabila cu lumina rosie, TEKNIM, TFS-1183R",141.99
"Sursa de alimentare in comutatie 24V 20A, Safer SAF-42PA",146.99
Sirena adresabila de interior cu avertizare luminoasa TEKNIM TFS-1181R,149.99
"Corp iluminat Emergenta 3 ORE, 3W EXIT, 3114",149.99
Sirena adresabila cu flash pentru interior Unipos FD7204D,149.99
"Sirena acustica, conventionala de incendiu, FIRECLASS H201",157.99
"Modul adresabil inteligent I/0 pentru centrale detectie la incendiu TEKNIM, TFM-1221",159.99
"Buton de incendiu adresabil, certificat EN54-11 Numens 660-001",159.99
"Sirena adresabila de interior cu avertizare luminoasa TEKNIM, TFS-1182R",159.99
Modul izolator de bucla FIRECLASS FC410LI,161.99
"Modul adresabil inteligent I/0, input-output compatibil cu seria TFP-12xx Teknim, TFM-1431",166.99
"Sursa de alimentare in comutatie 24V 25A, Safer SAF-43PA",167.99
Detector temperatura adresabil protocol Enea cu izolator inclus Inim ED200,169.99
Tester manual cu aerosoli pentru senzori de fum SMOKESABRE-01,176.99
"Buton de incendiu adresabil Morley-IAS, inteligent, montaj interior, ecran de protectie flexibil, cu izolator - Honeywell M5A-RP06FF-K013-41",177.99
Modul adresabil 3 IN / 6 OUT Unipos FD7203,179.99
"Detector fum si temperatura, adresabil, protocol Enea, izolator inclus, Inim, ED300",179.99
Sirena incendiu de exterior Unipos SB112F,179.99
Detector de fum optic si temperatura adresabil FIRECLASS FC460PH,179.99
Modul adresabil cu o intrare / o iesire supervizata protocol Enea Inim EU311,179.99
"Sirena de exterior pentru sisteme de incendiu 115dB, conventionala TEKNIM, TFS-5792",179.99
"Modul de conversie si alimentare detectori/bucle conventionale in adresabile, 24V, izolator integrat, TEKNIM TFM-1661",181.99
"Modul Morley-IAS, 1 intrare, izolator, Honeywell MI-DMMIE",181.99
"Spray aerosol pentru senzorii de fum, tester senzor fum, SOLO A10",183.99
Buton manual de incendiu adresabil protocol Enea – Inim EC0020,185.99
Sirena conventionala de incendiu cu flash pentru interior / exterior AH-03127-BS,191.99
Sirena adresabila de interior cu avertizare luminoasa TEKNIM TFS-1182W,193.99
"Kit wireless X-Sense STH54, cu termometru higrometru pentru monitorizarea temperaturii si umiditatii",196.99
"Modul Morley-IAS, cu 1 iesire, cu izolator - Honeywell MI-DCMOE",198.99
Senzor monoxid de carbon pe baterii FGA-13041 cu alarma sonora,199.99
"Modul extensie pentru stingere cu 2 iesiri releu, UNIPOS FD4201-2/",199.99
"Lampa LED EXIT 2W autonomie 3 ore montaj pe tavan, SKU-836",199.99
Lampa LED EXIT 2W autonomie 3 ore montaj pe perete SKU-8315,203.99
Extensie 1 Releu FIRECLASS FC410RIM,204.99
Modul adresabil cu o intrare si o iesire supervizata si releu Inim EM312SR,209.99
"Cablu special pentru sisteme antiincendiu JYSTY 1x2x0.8, rola 100 de metri",209.99
"Buton de incendiu adresabil, resetabil, cu izolator inclus, indicator LED, Detnov MAD-451-I",213.99
Detector de flacara UNIPOS FD8040,214.99
Sirena anti-incendiu de interior cu stroboscop Fireclass HS-201,217.99
Extensie 8 zone pentru centralele detectie INIM Smartline,219.99
"Releu semiconductor, 50A, 4/32V DC, 48/480V AC, 1- fazat, Anly Electronics ASR-50DA-H",224.99
Interfata cu 4 relee pentru centralele antiincendiu Unipos FD4201-4,226.99
"Buton de panica incendiu, adresabil, LED, IP40, Detnov MAD-450-I",229.99
"Modul 2 intrari si 1 iesire, cu izolator Morley-IAS - Honeywell MI-D2ICMOE",234.99
"Kit de detectie fum wireless X-Sense FS31, Wi-Fi 2.4GHz, control din aplicatie",239.99
"Sursa de alimentare 27.6V 1.8A, pentru centrale de incendiu Fireclass, BAW 50T24",239.99
"Detector de monoxid de carbon X-Sense XC01-R, cu ecran LCD, indicator LED, alarma",251.99
"Sirena de incendiu adresabil Detnov MAD-461-I, cu izolator inclus, alimentare din bucla",251.99
Buton de incendiu adresabil FIRECLASS FC420CP-I,258.99
Sirena de incendiu exterior AMC SR136-FIRE,259.99
"Detector standalone de monoxid de cardon X-Sense CO03D, cu afisaj alfanumeric, cu alarma, 3x baterii AA de 1.5V",264.99
"Detector monixid de carbon / CO2, pentru tavan DETNOV DMD-500",269.99
Extensie 8 zone Fireclass J400/EXP,279.99
"Detector de fum WisuAlarm Dahua HY-SA21A-W2(868), wireless, 868 MHz, alarma 85 dB",285.99
Soclu sirena adresabila FIRECLASS FC440DSB,288.99
"Cablu incendiu JE-H(St)H FE 180 E30/E90, 1x2x08 rola 100m MEK90-1x2x08",289.99
Modul de stingere Fireclass J400/EXT,291.99
"Modul Display LCD cu butoane pentru centrale Bentel J408 si J424, iluminat, 16 caractere x 2 linii, J400/LCD",299.99
Interfata de conectare pentru centrala de incendiu RS232-485,299.99
"Sursa de Back-up sisteme detectie incendiu 24V, 5AH 2X7AH",299.99
"Sirena de incendiu Inim ES2000, pentru interior, rosu, adresabila, IP65, Volum, sunet si durata ajustabile",303.99
"Sirena adresabila, cu flash, 101dB, IP65, consum redus, 14 tonuri selectabile, montaj aparent, Inim, ES2021RE",303.99
"Cablu special pentru sisteme antiincendiu JYSTY 2x2x0.8, rola 100 de metri SCHRACK",304.99
Lampa Exit LED cu kit de emergenta 3 ore Schrack,309.99
"Detector de gaz metan, pentru tavan, LED de stare, alarma sonora 85dB, Primatech, SECOR779/24V",313.99
"Sirena cu indicator luminos adresabila, de interior FIRECLASS FC430SAB",315.99
Detector CO pentru perete DETNOV DMDP-500,319.99
"Stroboscop sisteme detectie incendiu Morley-IAS - Flash inteligent, lentila de culoare rosie (EN54-23 clasa O), cu izolator, Honeywell WST-PR-I05",322.99
Sirena sistem de incendiu Honeywell WSO-PR-I05 cu carcasa de culoare rosie Morley-IAS,324.99
"Semnalizator luminos si acustic, 24V, 266mA, IP54, Qlight S60ADS-24A",334.99
Sirena adresabila de interior Inim ES0010RE,335.99
"Sirena de exterior cu LED pentru incendiu, 13.8V, IP34, compatibila cu modulul STD241201, Inim IVY-R",339.99
"Stroboscop sisteme detectie incendiu Morley-IAS -Flash inteligent, lentila de culoare alba (EN54-23 clasa O), cu izolator, Honeywell WST-PC-I05",345.99
"Sirena adresabila cu flash, 98dB, Inim ES2020RE, protocol ENEA, 14 tonuri, montaj aparent, IP65",351.99
"Detector wireless de fum si/sau temperatura, 868 MHz, Teknim, TWD-1850",352.99
"Sirena cu flash exterior pentru sisteme detectie incendiu, conventionala lentila transparenta, IP65 - Honeywell CWSS-RW-W5",354.99
"Detector standalone de fum si monoxid de carbon X-Sense SC07, alarma, indicator LED, baterie CR123A de 3V",359.99
Modul adresabil 4 intrari Inim EM340,359.99
Detector monoxid de carbon si temperatura Fireclass 601CH,361.99
Modul Ethernet pentru centralele Teknim Pars TXM-5271,386.99
"Automatizare cu lant pentru geamuri batante, Trape 24V KATO253 24V/Gri",398.99
"Buton wireless de incendiu, 868 Mhz, IP 30, resetabil, Teknim, TWB-1866",398.99
Modul comanda stingere pentru centralele INIM Smartline smartLetLoose/ONE,399.99
"Automatizare geam pentru ventilatie, 110/230 V, 250 N, KATO253 230V-GRI",399.99
"Automatizare cu lant pentru geamuri batante, Trape 24V KATO253 24V/Alb",399.99
"Automatizare pentru ventilatie, 110/230 V, 250 N, KATO253 230V-NEGRU",399.99
"Sirena sisteme de incendiu interior Morley-IAS, EN54-23 clasa O, Stroboscopica, lentila transparenta, izolator - Honeywell WSS-PC-I05",404.99
"Soclu pentru detector cu sirena si flash adresabil HoneyWell DSS-PC-I05, 96 dB, 32 tonuri, 29 V",404.99
"Automatizare cu lant pentru geamuri batante, Trape KATO253 24V/NEGRU Nekos",409.99
"Automatizare cu lant pentru geamuri batante, trape 230V KATO253 230V ALB",409.99
"Sirena adresabila cu far Detnov MAD-465-I, alimentare in bucla, izolator incorporat, 78.3-104.2dBA",419.99
"Cablu incendiu JE-H(St)H FE 180 E30/E90, 2x2x08 rola 100m",439.99
"Sursa de alimentare backup sisteme detectie incendiu 24V, 2Ah (MAX 3.5Ah) FP9000P certificata EN-54",449.99
"Modul de comunicare pentru centrale detectie incendiu TEKNIM, TFC-1201",452.99
"Detector de incendiu fara fir cu senzor de temperatura, AJAX FIREPROTECT BL",458.99
"Modul de comunicare RS485, pentru centrale detectie incendiu TEKNIM, TFC-1209",459.99
Detector adresabil de CO si temperatura Fireclass FC400CH,464.99
Modul adresabil extensie 1 intrare / 1 iesire FIRECLASS FC410SIO,469.99
Modul de extensie 8 zone Unipos FS5201,469.99
"Buton de incendiu adresabil Morley-IAS, montaj exterior, inteligent, ecran de protectie flexibil, cu izolator - Honeywell M5A-RP06FF-K013-41",471.99
Detector standalone de CO2. temperatura si umiditate cu alarma sonora Unit-t A37,479.99
Modul adresabil 4 iesiri supervizate Inim EM304S,479.99
Sursa 24V 3AH montaj acumulator 2X17Ah,479.99
Sirena autonoma de incendiu pentru exterior PS-128F,486.99
Sirena adresabila de interior cu flash Inim ES0020RE,494.99
Interfata monitorizare si operare centrale Bentel J400/BRIDGE,494.99
Extensie 1 zona - 32 senzori DETNOV MMD-509,499.99
"Centrala de incendiu conventionala, 2 zone, 32 de detectori, TEKNIM TFP-3122",509.99
Centrala detectie incendiu 128 detectori 4 zone Unipos FS4000-4,529.99
Sirena adresabila de interior fara Flash Fireclass FC440SR,548.99
"Centrala detectie incendiu conventionala 4 zone, Accepta 32 detectori/zona, TEKNIM TFP-3124",549.99
Comunicator LAN pentru centralele INIM SmartLine,549.99
Sursa de alimentare pentru centrala de incendiu FIRECLASS J-424-8M 27.6V,549.99
Detector de fum antiincendiu wireless Ajax,549.99
"Sursa de alimentare externa 24 VDC / 5Ah, cu back-up 2X12V, 7Ah sau 12Ah, cutie metalica, IP30, EN54-4, Teknim TPU-8245",549.99
"Sirena adresabila pentru interior, 16 tonuri, led intermitent, 103 dB, FC440AIR",554.99
"Modul de conversie a senzorilor cablati in senzori wireless, 868 mHz, 10 canale, Teknim, TWM-1887",561.99
Modul de extensie 1 bucla suplimentara pentru PL-1000 Morley-IAS Plus - Honeywell PL-LIB01,564.99
"Sirena wireless, LED cu lumina rosie, 868 Mhz, 95 dB, 3 niveluri de sunet, 3 moduri de iluminat, Teknim, TWS-1815",569.99
"Rama pentru montaj ingropat, compatibila cu MA-2000 Morley-IAS - Honeywell MA-2BZL",588.99
"Centrala detectie incendiu conventionala 4 zone TEKNIM, TFP-404",599.99
"Centrala de detectie incendiu conventionala, 4 zone, 32 de detectori, TEKNIM TFP-4404",599.99
"Cablu special pentru sisteme antiincendiu JYSTY 4x2x0.8, rola 100 de metri",599.99
"Centrala detectie incendiu conventional 6 zone, 192 detectori Unipos FS4000-6",599.99
Modul optional RS485 pentru conectare centrale Detnov in retea TRED-150,603.99
Repetor wireless Morley-IAS - Honeywell M200F-RF,625.99
"Centrala detectie incendiu conventionala 8 zone, Accepta 32 detectori/zona, TEKNIM TFP-4408",649.99
"Centrala detectie incendiu conventionala 8 zone, 32 detectori/zona, TEKNIM TFP-408",649.99
"Centrala detectie incendiu conventionala 8 zone, max 256 de detectori, Unipos FS4000-8",649.99
Modul adresabil extensie 3 intrari / 4 iesiri FIRECLASS FC410MIO,677.99
"Programator TEKNIM pentru detectori, senzori, butoane, sirene, alte dispozitive, TFCM-1801",679.99
"Modul de comunicare 4G, pentru centrale detectie incendiu TEKNIM, TXM-5474",709.99
"Detector optic de fum, wireless, Morley-IAS - Honeywell 22051E-RF",719.99
"Rama pentru montaj ingropat, compatibila cu MA-8000 Morley-IAS - Honeywell MA-8BZL",734.99
"Cablu incendiu JHSTH E90, 4x2x0.8, manta ignifuga, rola 100m, JHSTH-4x2x0.8-E90",779.99
Repetor pentru centralele INIM SmartLine panou LCD,787.99
"Buton de alarmare incendiu conventional, indicator LED, MCP220EX",814.99
Modul adresabil 4 intrari / 4 iesiri pe releu Inim EM344R,816.99
"Comunicator PSTN, 5 intrari/iesiri, ContactID, DTMF, modul vocal integrat Inim SmartLinkAP",822.99
"Centrala de incendiu conventionala 4 zone, 32 detectori/zona, Fireclass J-408-4M",831.99
Repetor pentru centralele conventionale Bentel J400/REP,844.99
"Centrala detectie incendiu conventionala 4 zone extensibila la 20, max 128 detectori, meniu Romana SmartLine020/4",858.99
Modul conectare TCP/IP pentru centralele FIRECLASS FC500IP3,899.99
"Centrala de incendiu Conventionala 8 zone, max 32 detectori/zona, Bentel J408-8M",939.99
"Repetor wireless pentru centralele antiincendiu, compatibil cu TWM-1885 si TWM-3885, Teknim TWM-1886",941.99
Modul pentru comanda a pana la 3 regulatoare de viteza pentru ventilatie DETNOV TRMD-500,949.99
"Tastatura pentru centrala de incendiu Inim PREVIDIA-C-REPW, ALB, conexiune RS485",950.99
"Set trei prisme, 1010-000",967.99
Automatizare desfumare cursa 200-500MM certificat EN 12101-2 KATO 305 RWA 24V-ALB,969.99
"Panou repetor pentru centralele Previdia, TCP/IP, ecran 4.3"" touchscreen, S-PREVIDIA-CREPW, Inim",969.99
"Modul I/O, wireless, Morley-IAS - Honeywell M211E-RF",988.99
Cablu sisteme antiincendiu JYSTY 1x2x0.8 tambur 500M,999.99
"Sursa de alimentare in comutatie 27,6 Vcc / 4 A, cu back-up, cutie metalica, IP42, Inim SPS24160S, EN54-4",999.99
Automatizare desfumare cursa 200-500MM certificat EN 12101-2 Nekos 305 RWA 24V-NEGRU,1009.99
"Cablu incendiu NHXH E90FE180 PH120, 3x2.5, rola 100m, 21303025",1029.99
"Detector multicriterial, optic, termic si IR, wireless, Morley-IAS - Honeywell 22051TLE-RF",1033.99
"Comunicator intre centrale cablate conventionale si detectori wireless Teknim, 868mHz, IP65, TWM-3885",1067.99
Repetor centrale adresabile FIRECLASS FC500REP,1100.00
Centrala detectie CO cu o zona si 30 de senzori DETNOV,1149.99
"Comunicator intre centrale adresabile cablate si detectori wireless Teknim, 868 mHz, ecran OLED, TWM-1885",1159.99
"Modul expandor 2 bucle pentru centrale Detnov, TBUD-150",1206.99
"Cablu incendiu JHSTH E90, 1x2x0.8, tambur 500m, Q5+ JHSTH-1x2x0.8x500M-Q5+",1244.99
"Automatizare cu lant pentru geam, cu telecomanda, 220V, 300N, 40 cm, KATO-ADV-RADIO",1246.91
"Automatizare cu lant pentru geam, cu telecomanda, 230V, 433MHz, 300N, neagra, KATO-ADV-RADIO-Negru",1246.99
"Sirena adresabila, wireless, Morley-IAS, carcasa de culoare rosie - Honeywell WSO-RR-RF",1248.99
Gateway wireless Morley-IAS - Honeywell MI-GATE,1257.99
Cablu sistemele antiincendiu E30/E90 JHSTH 1x2x0.8 JHSTH-1x2x0.8 500M,1274.99
"Detector de fum punctual cu sensibilitate ridicata, Morley-IAS Honeywell MI-LZR-S3I",1392.99
"Cablu incendiu JE-H(St)H FE 180 E30/E90, ecranat, tambur 500m, MEKAS KABLO MEK90-1x2x08-T",1449.99
"Repetor centrale adresabile, ecran LCD, Teknim TFP-1240",1462.99
"Centrala de incendiu 8-24 zone, max 32 detectori/zona, Bentel J-424-8M",1499.99
Cablu sisteme antiincendiu JYSTY 2x2x0.8 tambur 500M,1549.99
"Repetor cu LCD pentru centrale Bentel FC503 si FC506, FC50XREP",1554.99
"Modul Morley-IAS, 6 iesiri releu, izolator, Honeywell MI-CR6-S2I",1579.99
Centrala detectie CO cu doua zone si 60 de senzori DETNOV,1599.99
"Modul Morley-IAS, 10 intrari monitorizate, izolator, Honeywell MI-IM10-S2I",1674.99
KIT ANTIINCENDIU CONVENTIONAL 10 Senzori,1742.99
"Centrala de incendiu conventionala, 8 zone, extensibila la 32, max 32 detectoare/zona, Unipos FS5200",1749.99
"Panou repetor cu ecran LCD pentru centrale SmartLoop, Inim, SmartLetUSee/LCD",1845.99
Cablu sistemele antiincendiu E30/E90 JHSTH 2x2x0.8 500M,1999.99
Centrala detectie CO cu trei zone si 90 de senzori DETNOV CMD-503,1999.99
Bariera activa de fum 100 metri AVS BF 100A,2042.99
"Panou repetor pentru centrale Detnov, RAD-150",2067.99
Kit sistem anti incendiu conventional 16 elemente Fireclass,2068.99
Repetor centrale incendiu adresabile Unipos IFS7002R,2085.99
"Centrala de stingere si desfumare, 3 zone, max 32 detectoare/zona Unipos FS5200E",2192.99
Centrala analogica adresabila cu 1 bucla x 100 adrese Detnov CAD-150-1-Mini,2214.99
KIT ANTIINCENDIU CONVENTIONAL 18 Senzori cu sirena si buton,2237.99
"Cablu incendiu JE-H(St)H FE 180 E30/E90, 2x2x0.8, ecranat, rola 500m, MEK90-2x2x08-T",2244.99
"Sistem detectie incendiu conventional, 20 senzori de fum, detector gaz, sirena interior/exterior, Teknim, KITCONVTEKX20",2261.99
